### ISSUE TITLE
More timeout errors in macos Distributed CI

### ISSUE THREAD

**Issue by Keno** [JuliaLang/julia#38812]
https://build.julialang.org/#/builders/79/builds/6824/steps/5/logs/stdio

**Comment by Keno** [comment]
Managed to capture a dtruss log of this failure:
https://gist.github.com/Keno/aa88db28db97a0c3447917067110bc05

not sure it's helpful yet.

**Comment by Keno** [comment]
I believe this may be a kernel bug. See the following gist capturing packets: https://gist.github.com/Keno/910044146b9220c69d2d00560aa13b5b

In relevant part:
```
282385	542.688435	127.0.0.1	127.0.0.1	TCP	56	57818 → 9362 [FIN, ACK] Seq=1965 Ack=111 Win=408128 Len=0 TSval=1995826939 TSecr=1995826939
282387	542.688449	127.0.0.1	127.0.0.1	TCP	56	9362 → 57818 [ACK] Seq=111 Ack=1966 Win=406336 Len=0 TSval=1995826939 TSecr=1995826939
283122	552.042151	127.0.0.1	127.0.0.1	TCP	68	[TCP Port numbers reused] 57818 → 9362 [SYN] Seq=0 Win=65535 Len=0 MSS=16344 WS=64 TSval=1995836153 TSecr=0 SACK_PERM=1
283123	552.042167	127.0.0.1	127.0.0.1	TCP	56	[TCP ACKed unseen segment] 9362 → 57818 [ACK] Seq=1 Ack=2006413062 Win=6349 Len=0 TSval=1995836153 TSecr=1995826939
```

So it looks like the kernel is finding some random previous connection and ACKing it rather than starting a new connection. However, more concerningly, I don't believe the kernel should have given out this socket again. The default TCP MSL on macOS (and on this system) is 15 seconds, so at this time (10 seconds later), the original socket should be in TIME_WAIT state, which IIRC means it should just be dropping packets rather than acking them (and shouldn't have given out the port in the first place), but I'm a bit out of my depth.

**Comment by Keno** [comment]
It's definitely not just the raw port reuse that's causing the problem - that happens many times in the log. It's some sort of kernel condition that causes it to get angry.

**Comment by Keno** [comment]
Ah, hold on these are relative sequence numbers, so it is actually just finding the previously closed connection and trying to re-ack it. That should be prevented by `bind` refusing to bind to it as long as the server socket is in TIME_WAIT state.

**Comment by Keno** [comment]
Ah, hold on, libuv explicitly sets SO_REUSEADDR on the server socket, which would allocate a second pcb, but because there's one already there, which one you see depends on the order of the pcbs in the pcb hash table.

**Comment by Keno** [comment]
Here's a pure-C reproducer that I believe reproduces the same issue. It seems to work reliably on windows, but fails with ETIMEDOUT about 50% of the time for me on macOS.
